{
  "$schema": "../demo.schema.json",
  "schemaVersion": 1,
  "id": "fetch-retry-helper",
  "title": "Fetch with retries and exponential backoff",
  "description": "A dependency-free JavaScript helper that retries failed fetch requests with exponential backoff, jitter, and a per-attempt timeout.",
  "tags": ["JavaScript", "Fetch API", "Resilience", "Node.js"],
  "author": "Stacked demos",
  "updated": "2026-10-09"
}
